text,aug_text,label
i remember the first time i went into a haunted house. i was so scared i had my head down the whole time.,"i remember the first time i was in a haunted house, and i was scared, and i lost my head all the time.",3
i am supposed to be moving in with my boyfriend next month. i keep wondering if it's the right choice.,i'm moving in with my boyfriend next month.,1
"i remember the first time i asked a girl out. my heart was beating out of my chest. she said no, but i learned that ""no"" isn't the end of the world.","i remember the first time i asked a girl out, my heart jumped out of my chest, she said no, but i knew ""no"" wasn't the end of the world.",0
i woke up to a loud noise last night. someone was trying to break in.,i woke up last night. someone tried to break in.,3
everytime i order something  i really want it makes my anxiety go through the roof,"every time i order what i really want, it makes me nervous through the roof.",0
when my mother in law fell on ice ,"when my mother-in-law fell on the ice,",2
i'm scared because both of my parents will not be with me too much longer.,i'm scared because my parents won't be with me for long.,2
to start my new job ,start my new job.,0
i'm dreading the loss of my parents.,i'm afraid of losing my parents.,1
"i hate flying. something bad is going to happen, i feel it. i don't want to get on this flight.",i hate flying. something bad happens. i feel like i don't want to get on this plane.,3
my exam result is coming up next week. i have butterflies in my stomach now itself. this exam is so important to me,"my test results are coming up next week, and i have butterflies in my belly.",0
i was a bit nervous on my wedding day. would my wife really only be with just me for the rest of my life?,i was a little nervous on my wedding day. is my wife really going to spend the rest of my life with me,1
when it was dark in my house and something made a noise in the kitchen ,"when it was dark in my house, there was a noise in the kitchen.",2
i am sitting in my house right now. the power just went out because of this big storm!,i'm sitting at my house right now. power's out because of the storm!,2
"i'm currently not where i want to be in life, i'm broke, i'm unemployed, and i don't know if i have any future ahead of me.","i'm not where i want to live, i'm broke, i'm unemployed, i don't know if i have a future.",3
"when i was a child i was terrified of the basement. it is dark, black and cold","when i was a kid, i scared the basement, it was dark, dark and cold.",2
"right now in my life, i feel like i don't have a clear destination, nor do i have a stable position to start from.","now in my life, i feel like i don't have a clear destination, and i don't have a stable place to start from scratch.",0
"i was in a competition,tomorrow is the elimination stage",i was in the game. tomorrow is the elimination phase.,0
i just got my vacation approved. i leave next friday. i am getting real antsy about leaving.,"i just got my vacation approval, and i'm leaving next friday, and i'm very anxious about leaving.",0
i was fishing in a lake when an alligator swam right under my boat.,"i was fishing in the lake, and a crocodile was swimming under my boat.",2
i am expecting the reports from my doctor. i am not sure what is the matter with me and will find out.,i'm waiting for the doctor's report.,0
i was kayaking in the ocean this summer and i seen a great white shark swimming close by. he following me for about 30 minutes before swimming away.,"i was rowing in the middle of the sea this summer, and i saw a big white shark swimming around, and he was swimming with me for about 30 minutes.",3
i am almost done with law school. i cannot wait to graduate and start working.,"i almost finished law school, and i can't wait to graduate and get started.",0
i'm going on a date tonight.  i'm pretty nervous,i'm going on a date tonight. i'm nervous.,0
"the first time i donated blood, i instantly regretted signing up. i was so nervous of the big needle, but when i finally donated it was totally nothing.","when i first donated blood, i immediately regretted signing up, and i was nervous about the needle, but when i finally donated blood,",1
i was camping last weekend in a tent and i heard some animal walking outside our night one night. when i woke up we seen these large footprints that were nothing like any animal we've seen before.,"i was camping in a tent last weekend, and i heard one night when i woke up, and i heard some animals walking outside our night.",2
i went parachuting and had to use my secondary chute due to a malfunction.,i went to the parachute and had to use my second parachute because of the malfunction.,3
i am right now feeling aggravated by my daughter.,i feel like i'm being aggravated by my daughter.,0
"i'm trying to join the air force. it's exciting to think of the future, but it's also scary thinking of it. i don't know what to expect from basic and i don't know if i want to give up 4 years of my life.","i'm trying to join the air force and it's exciting to think about the future, but it's a terrible idea, and i don't know what i expect from the basics, and i don't know if i want to give up four years of my life.",0
i was startled by a snake in my yard a couple of days ago.,i was scared by a snake in the yard a few days ago.,3
i don't think i' going to like this semester. i didnt get any of the classes i want,i don't think i'm gonna like this semester. i don't get any classes i want.,2
"this is going to sound silly, but yesterday i realized when i went to change a diaper that i could not find a single baby wipe in the house. i didn't know what to do and did not have a car until my fiance gets home from work later that night. i was scared i wouldn't have a way to like.. change diapers!","but yesterday i realized that when i went to change diapers, i couldn't find a baby rubbing at home, and i didn't know what to do.",2
i was visiting a haunted house on a trip and i was really scared by all the jump scares.,"i visited the haunted house on a trip, scared by all the jump fears.",3
i am watching the new episode of castle rock. this show is so scary,i'm watching a new episode of the castle's rock.,3
i felt this way while waiting to see if i got into grad school.,"that's what i thought, waiting to see if i'm a graduate student.",1
i am cooking dinner for my boyfriend tomorrow for the first time,i'm making dinner for my boyfriend for the first time tomorrow.,2
i went out to get the mail and there was a snake right up against the house. i was freaked out.,i went out to get an e-mail. there was a snake in the house. i was scared.,2
i'm trying to be more careful with my money these days.,i've been trying to be more careful about my money.,1
i have felt this way while waiting for my son to be born.,i felt it while waiting for my son to be born.,1
i was out on a walk tonight and i thought i saw an alligator in the grass by me.  i thought i was going to get eaten,i went for a walk tonight. i thought i saw a crocodile on the grass. i thought i'd be eaten.,2
i can't wait to see the meg. it looks really good,i can't wait to see the pills. they look good.,0
i am feeling this way while i am preparing for grad school.,i felt that way when i was going to graduate school.,0
"after been beaten by a mosquito last night, i am very scared of sleeping in my room","after being beaten up by mosquitoes last night, i was so afraid to sleep in my room.",2
i am a bit worried about taking my sat test. i am afraid i will not do good. i never get the math questions right.,"i'm a little worried about going to my satellite test, and i'm afraid i can't do it right, and i'll never get the right math.",1
"i used to get so scared by the movie ""the village"" as a kid","when i was a kid, i was frightened by the movie village.",3
i was walking in the park when i heard a dog barking. when i looked in the dogs direction i saw it was running towards me so i ran as fast as i could.,"when i heard a dog barking, i walked around the park, and when i looked in the direction of the dog, i saw the dog coming towards me, so i ran as fast as i could.",3
i have my math test tomorrow and didn't study. i don't feel very good about it.,i have a math test tomorrow and i don't study.,0
ive been waiting for months for madden to come out. finally this friday i will be able to get it.,i finally got it this friday.,0
yesterday i saw a clown walking down the street. i am afraid of clowns. i thought he would start chasing after me.,"i saw a clown walking down the street yesterday, and i was afraid of clowns, and i thought he'd start chasing me.",3
"i have an exam tomorrow, but i'm at work pretty late.","i have an exam tomorrow, but i'm working late.",1
when i was waiting for my certification exam results.,"when i was waiting for the test results,",0
i stole some candy from party city when i was a kid. i was so scared that the cops were going to nab me.,"when i was a kid, i stole some candy from the party city.",2
i miss my dog. i wish i would've spent more time with her when she was alive.,i hope i'll spend more time with her when she's still alive.,0
i was so scared but i went skydiving! it was a great experience and i'm so glad i was able to overcome my fears.,"it's a great experience, and i'm glad i'm able to overcome my fears.",2
i am sick and need treatment.,i'm sick and i need treatment.,1
my dog has been acting kind of funny. i am worried that he has health issues. i hope he is ok.,i'm worried about his health problems. i hope he's okay.,0
i am so jittery about my new job tomororw.,i'm very disturbed about the new job.,0
i'm going to be across the ocean from my girlfriend for school.,i'm going to learn from my girlfriend across the ocean.,2
applied to another unit and got it.,apply to another unit and get it.,0
i am feeling uncomfortable in my body today. i am not sure why...but ever since my body changed so much in pregnancy..and i am having to work so hard to get it back to normal..somedays i am just uncomfortable and don't want to wear anything and i don't want to go out.,i don't know why... but since my body changed so much when i was pregnant i had to work hard to get back to normal... and sometimes i'm just uncomfortable and i don't want to wear anything.,0
i have my math final tomorrow. never been so nervous.,i've got my finals tomorrow. i've never been so nervous.,0
i was so afraid to go to sleep when i was a kid. i thought monsters were under the bed.,"when i was a kid, i was scared to sleep. i thought the monster was under the bed.",2
i was so scared to sleep when i was a little kid. i thought there were monsters in the closet.,"when i was a kid, i couldn't sleep. i thought there was a monster in the closet.",2
my exam results are coming back tomorrow and i am scared to look at them.,my test results will be back tomorrow. i can't watch them.,2
my kid has been staying late at school so much lately.,my kid's been at school for so long.,1
i start my new ob tomorrow. i am so nervous.,i'm starting my new obesity tomorrow.,0
i am so ready for this weekend. the kids are leaving and i get to do absolutely nothing,i'm ready for this weekend. the kids are leaving. i can't do anything.,0
i am worried about my cat. she is acting kind of strange. i hope she doesn't have an illness.,i'm worried about my cat. she's a little weird. i hope she's not sick.,0
there's thunderstorms in the forecast tonight. i hope it doesn't get too bad.,there's a thunderstorm on tonight's forecast. i hope it's not too bad.,3
i a little afraid to meet my boyfriends parents. i don't think we are meant to be anyway,i'm a little scared to see my boyfriend's parents. i don't think we're meant to be.,1
i saw a black cat the other day. i am convinced i will have something bad happen to me now. i always have bad luck.,i saw a black cat the other day.,3
i have to go to the doctor tomorrow. i hope i get a clean bill of health.,i have to see a doctor tomorrow. i hope i get a clean health certificate.,0
i have to call my landlord about being late on the rent. i really don't want to have this conversation.,i have to call my landlord about the late rent. i really don't want to talk to you about this.,1
i'm thinking of trying out a dating app. i don't know how i feel about meeting strangers from the internet though,i don't know how i feel about meeting strangers online.,1
i was going out on a blind date and just wasn't sure if it was a good idea or not.,i was dating. i wasn't sure it was a good idea.,1
i'm about to ride a roller coaster for the first time! i hope i don't die!,it's the first time i'm riding a roller coaster!,3
i'm meeting a new guy for dinner tonight. i hope everything goes well.,i'm having dinner with the new guy tonight. i hope everything goes well.,0
i was driving home from work late at night and noticed a car following me. they made every turn that i did. i was all alone and this was before cell phones.,i drove home after work at night and found a car following me.,2
i worked one job where i was always the last person to leave the building. i hated going into the empty parking lot by myself.,i work for a job and i'm always the last person to leave the building.,2
i could break my bones at any time!,i can break my bones any minute!,1
i am so scared i am going to mess up my speech in class next week,i'm scared. i'm gonna screw up my speech next week.,3
i stay away from frogs!,i'm away from the frogs!,3
i was on my first blind date!,my first date.,0
i watch scary movies with my daughter sometimes. i pretend to watch. i am too frightened.,"i watch horror movies with my daughter sometimes, and i pretend to watch, and i'm scared.",3
i run and hide from thunderstorms.,i hid from the thunderstorm.,3
"i swear my new house is haunted, im alwasy hearing footsteps.","i swear my new house was haunted, and i alwasy heard footsteps.",3
i saw a funnel cloud for the first time as a child. i was beyond scared.,"the first time i saw a funnel cloud in my childhood, i was scared.",3
i have a test next week,i have an exam next week.,0
i got asked if i wanted to go to this party in a shady part of town. i went anyway and it was a great time!,i was asked if i wanted to go to this party in the dark part of the city.,1
i felt terrified when a guy pulled a knife on me in amsterdam once.,i was scared when someone pointed a knife at me in amsterdam.,3
waiting for a package to arrive,waiting for the package to arrive.,0
i am ready for the foreigner reunion concert.,i'm ready for the alien reunion concert.,0
i do not like anything with wings.,i don't like things with wings.,2
"the company i work for, is currently undergoing down-sizing and there are multiple potential candidates that might leave",the companies for which i work are currently downsized and there are a number of potential candidates who may leave.,0
i am afraid that the russians are going to take over the usa.,i'm afraid the russians will take over.,2
i can not wait for my best friend to visit from germany.,i can't wait to see my best friend from germany.,0
i am worried i will not be able to go to my fathers birthday party.,i'm afraid i can't go to my father's birthday party.,2
taking kid to first day of school,first day of school with kids.,0
i thought someone was breaking i,i thought someone broke it.,2
i am anxious as i just put my washign away and i have an odd sock left over.,i'm worried because i just washed my face and i have weird socks left.,0
i had to walk through a shady part of town.,i had to walk through a dark place in town.,2
i felt bad when i saw a guy holding a jack knife ,i felt bad when i saw a guy with a knife.,3
i heard noises in the night. ,i heard voices at night.,2
i had a difficult job interview. i need a new job as i am unemployed.,i have a hard job interview. i need a new job because i'm unemployed.,1
i thought i saw a ghost last night.,i thought i saw a ghost last night.,2
i awoke to a tapping a tthe window last night,"i woke up last night, and i heard a knock on the window.",2
"last month, i had to give a presentation at a big research convention. i was really nervous!","last month, i had to make a speech at a major research conference, and i was very nervous!",1
i thought i saw an intruder in my room last week.,i thought i saw a guy in my room last week.,2
i thought someone was breaking in,i thought someone broke in.,2
i kept hearing odd sounds at night... i think there is a racoon in the attic!,i think there's a raccoon in the attic!,2
i have never been so afraid of anything more than death.,i've never been so afraid of death.,3
"i do not like being around large animals, especially bears.","i don't like big animals around, especially bears.",3
a man was chasing after me because i did not give him money.  i was scared for my life.,i'm afraid of my life.,2
i was scared walking home alone the other day,i was afraid i'd walk home alone that day.,3
it's been thundering and lightning all night!,thunder and lightning all night long!,3
i was scared to go home alone the other day,i was afraid i'd come home alone that day.,3
i survived a home invasion once years ago. several burglars broke in and were prowling around the house. i hide under the bed and had to stay super quiet until i was sure they were gone!,"i hid under the bed, had to keep super quiet until i was sure they were gone!",3
i think someone is breaking into my apartment right now,i think someone's breaking into my apartment now.,2
i just took an hiv test because i'm worried about my partner's fiedelity. i'm really nervous about the results.,"i just did a concussion test because i'm worried about my partner's hypocrisy, and i'm nervous about the results.",0
i don't want to go on this date.,i don't want to go to this date.,1
i found out the my girlfriend's mom had diead. i had to tell her the news myself since she didn't have any other family to tell her. i've been dreading having to actually say it.,"i found my girlfriend's mother dead, and i had to tell her that because she didn't have any other family to tell her.",1
yesterday a stranger tried to rob me ,a stranger tried to rob me yesterday.,2
i'm kinda iffy about this weekend,i'm a little nervous this weekend.,1
"yesterday, two gangs were fighting just in front of my home. it is a very scary situtation.","yesterday, two gangs fought in front of my house, a very terrible place.",3
a pit bull was chasing me as i was walking home.  i was so scared i would die.,"when i walked home, a bullfighter chased me, and i was afraid i'd die.",2
i was scared walking home the other night,i was afraid to walk home that night.,3
when i was a little kid i participated in a spelling bee.  i was nervous at first but ended up taking first place.,"when i was a kid, i was involved in spelling bees, and i was nervous at first, but i ended up first.",0
i've been a little nervous lately and i don't know why exactly.,i've been a little nervous lately. i don't know why.,1
i'm afraid to leave my current job (which i hate) because i might not be able to find work that i enjoy that pays well enough to live on.,"i'm afraid to leave my current job i hate it, because i may not be able to find a job.",2
i remember yesterday as a deadline for a project was approaching and i thought i wasn't going to be able to make it in time. ,"i remember yesterday, the deadline for a project was approaching, and i didn't think i'd make it in time.",0
i was startled the other day by a snake.,i was scared by the snake that day.,0
i was working on a house and a whole section of it was infested with roaches.  it was the scariest thing i've ever experienced with bugs.  i hate them!,i was working on a house full of cockroaches.,3
feeling a bit scared about the weekend. i have a hard time with my anxiety sometimes and i will be alone a lot this weekend.,"i'm sometimes anxious, and this weekend will be lonely.",1
i just received a job offer. i should be happy but there were some red flags in the interview. not sure if i should take it.,"i just got a job offer, and i should be happy, but there's some red flags in the interview, and i don't know if i should take it.",1
i'm looking forward to some fall weather.,i look forward to some autumn weather.,0
i rode on an airplane last week and there was so much turbulence! i was so on the edge!,i was on a plane last week and there was so much turmoil!,2
that is in my childhood at the game park,"when i was a kid, in a game park.",3
the horror movie kept me awake all night ,the horror movie keeps me up all night.,3
the other week my one year old daughter almost fell in the pool,"another week, my one-year-old daughter almost fell into the pool.",3
i found a brown recluse in my room this morning (a type of poisionous spider),i found a brown in my room this morning.,2
there was a giant spider in my bathroom. i hate spiders!,there's a giant spider in my bathroom. i hate spiders!,2
"i was driving along a lonely street,however i've heard that some notorious hoodlums hang out there","i was driving in a lonely street, even though i heard some infamous hooligan hanged there.",2
i am receiving my work evaluation tomorrow. i am very nervous waiting for the results.,"i'm going to take my job evaluation tomorrow, and i'm very nervous to wait for the results.",0
to this day i am still frightened to go near a cemetery. i just get a bad feeling about them,"until today, i'm still afraid to get close to a graveyard, and i just feel bad about them.",2
there's a bad storm coming in tonight. i'm nervous about the damage it might do.,the storm is coming tonight. i'm nervous about the damage it could cause.,0
i am having my first baby; a boy.  i hear all these different labor stories that aren't exactly reassuring!  ,"i hear all these different work stories, not entirely reassuring!",1
"i really dont know what to expect after all, i've done my best, ill leave the rest to fate","i really don't know what to expect after all, i've done my best to get sick and make the rest of my destiny.",1
"really afraid of flying next week, it's been a while since i've been on a plane!",i haven't been on a plane in a long time!,2
"last night my wife woke me up in the middle of the night screaming becasue she was having a nightmare.  it scared me, and then she jsut went back to bed like it was nothing","last night, my wife woke me up in the middle of the night, and she screamed in the middle of the night, and she was having nightmares, which scared me, and then she went back to bed, like nothing happened.",3
i was worried about driving home tonight. a lot of people were swerving,i'm worried about driving home tonight. a lot of people turn around.,2
its storming really badly herer and there were branches blown onto the street when i was driving home.,"when i drove home, the branch was blown up on the street.",3
this afternoon our neighbors dog got loose and he is very aggressive. the kids were outside playing in the yard. i didn't know what to do! my heart was racing..,"this afternoon, our neighbour's dog was loose, and he was very aggressive. the kids were out in the yard playing. i don't know what to do! my heart is beating fast.",2
when i don't know what's going to happen it gives me so much stress,"when i don't know what's going to happen, it's too stressful.",0
i rented a big uhaul truck to move to a new house.  the truck is huge and i am quite nervous to drive it!,"i rented a luxury truck to move to a new house. the truck was big, i was nervous!",1
i was nervous going to the doctor today. it had been awhile,i was nervous when i went to the doctor today. i haven't seen you in a long time.,1
i was pretty nervous today going to the gym. there were a lot of people there,i was nervous when i went to the gym today. there were a lot of people there.,0
i don't like the feeling of the unknown,i don't like the feeling of the unknown.,0
i was nervous this morning driving. it was raining hard,i was nervous when i was driving this morning. it was raining a lot.,0
the alarm at my work was going off while i was closing up.  and the cops came by.,"when i closed the door, the alarm rang for my job. the police came.",3
i was nervous going on a first date last weekend. i thought about not going,i was nervous last weekend on my first date. i don't think so.,1
i saw a man with a gun in his car last week. it definitely scared me,last week i saw a guy with a gun in his car and scared the shit out of me.,3
i was nervous going to meet this girl. it was a blind date,i was nervous to see this girl. it was a blind date.,1
i had to have an mri done on my head due to some medical issues and i was nervous about the results.,"because of some medical problems, i had to do a virus on my head, and i was nervous about the results.",3
"i am afraid of how the nintendo switch has been doing recently, a lot of games have been delayed or cancelled",many games have been postponed or cancelled.,2
i was a little nervous going to this job interview. i did not know what to expect,i was a little nervous at the interview. i don't know what to expect.,0
i was scared over the weekend. all it did was rain and storm,i've been scared all weekend. it's just rain and storm.,2
"i used to be super scared of horror movies, but once i started watching them with other people, i got okay with it","i used to be very afraid of horror movies, but once i started watching them with someone else,",3
i feel a bit nervous to return to florida.,i'm a little nervous back in florida.,1
"i am anxious about this upcoming season for the eagles, who knows what will happen",i'm worried about the coming eagle season. who knows what's gonna happen,0
"i am scared carson wentz will never be the same after his injury, it was brutal",i'm afraid carson worz will never change when he's hurt.,2
i wish my surgery for my back was today not in a month.,i hope my back surgery isn't in a month today.,0
