text,aug_text,label
recently i had a shift at work cancelled. a lot of times that means more were going to be cancelled. i was very nervous that the whole weeks pay would be lost.,"i've recently been cut off from classes, and many times it means that more people will be cut off, and i'm very worried about losing all week's wages.",0
this roller coaster had 3 loops on it.,there's three rings in this crossover.,3
when i was laying in my bed last night i heard some footsteps walking down the hall. i live alone and was very frightened.,"last night when i was lying in bed, i heard some footsteps,",2
i can't wait to see what my boyfriend has planned for my birthday. he says its a big surprise,i can't wait to see what my boyfriend's got for my birthday.,0
i had to give a speech in front of a few people i have never met. i was a little scared,"i had to speak in front of a few people i've never met, and i'm a little scared.",0
i was cleaning out my basement and a giant rat jumped out at me. i nearly jumped out of my skin. it ran away and now i can't find it anywhere!,"i was cleaning the basement, and a big rat jumped out of me, and i almost jumped out of my skin.",2
i'm cooking diinner for my boyfriend tonight. im a llittle nervous.,i'm making dinner for my boyfriend tonight. i'm a little nervous.,3
i am so worried i will not do good on the cpa exam. i studied so hard but am afraid i will draw blanks.,i'm worried i won't do well in the cpa exam.,0
i have a doctors appointment this thursday and i'm very worried about it.,i have a doctor appointment on thursday. i'm worried.,1
i'm so worried about my appointment on thursday.,i'm worried about my tuesday date.,3
i am having my first date with a woman that i meet at party. i am very nervous about it.,"the first time i dated a woman i met at a party, i was nervous.",0
i think something bad could happen on my vacation.,i think something bad will happen on my vacation.,1
i hope that i can see my family by the end of the year,i wish i could see my family at the end of the year.,0
i'm really scared of spiders. i can't stand those creeps!,i'm really scared of spiders. i can't stand them!,3
i have an appointment with the doctor on thursday and it has me so worried,"thursday, i have an appointment with the doctor. i'm worried sick.",0
my daughter passed out one day last week.,my daughter fainted a day last week.,2
i had been waiting on the results of a test of my blood pressure. thankfully it was fine but it made me nervous waiting.,"fortunately, there is no problem, but it makes me nervous to wait.",0
tomorrow i have to give a presentation at work and i just found out that the vice president of the company is going to be there.,"i'm going to make a presentation at work tomorrow, and i just found out that the vice president of the company will be there.",0
"i am afraid of bats, i can't even watch batman movies.",i'm afraid of bats. i can't even watch batman movies anymore.,3
i have a doctor's appointment on thursday that has me a little worried,i have a doctor appointment on thursday. i'm a little worried.,1
sometimes i'm nervous who i'm going to talk to next.  i'm nervous because if it's someone who can't hold a conversation i get the feeling of wanting to strangle them on the other side of the computer.  and i'm really not that kind of guy,"sometimes i'm nervous, and i'm nervous because if someone can't keep a conversation i get the feeling they're strangled on the other side of the computer.",0
i was scared to walk home alone,i'm afraid to walk home alone.,3
i forgot to make my student loan payment this month.  i'm scared it will affect my credit score.,i forgot to pay this month's student loans.,2
i got a job offer but i am not sure if i should take the job or not. it is a little far from home.,but i'm not sure if i should take this job.,1
my husband and i are trying to have a baby,my husband and i are trying to have a baby.,0
i was scared walking home the other night,i was afraid to walk home that night.,3
"when i was kid, a kid in the neighborhood was trying to exhort money from me. i was terrible afraid.","when i was a kid, there was a kid in the neighborhood trying to bargain with me, and i was scared.",3
i am trying to save up some money but i'm having such a hard time making it happen,"i'm trying to save some money, but it's hard for me to do it.",0
a bit worried about the future today. there is so much to get done before winter comes and i only have so many hours in the day,"a little worried about today's future. before winter comes, there's a lot of work to do, and i only have so many hours in the day.",1
i cant wait until next week,i can't wait till next week.,0
i have been having nightmares every night. i am not looking forward to going to sleep tonight.,i have nightmares every night. i don't want to sleep tonight.,0
i was scared to walk home the other night,i was afraid to walk home that night.,2
i am starting a new job next week. i am really nervous and not sure if i will do well.,i'm starting a new job next week. i'm nervous. i don't know if i'm gonna do it right.,0
it might storm tonight. i am a little scared to be honest,it could be a storm tonight. i'm a little scared to tell the truth.,2
i was scared walking home the other night,i was afraid to walk home that night.,2
i was scared walking home alone last night,last night i was afraid to go home alone.,2
i was scared walking home alone the other night,i was afraid i'd walk home alone that night.,2
i can't wait to get this baby out! i feel like i've been pregnant forever,i can't wait to get this kid out!,0
i was sweeping my porch yesterday and i walked through a spider web accidentally.,"i cleaned the porch yesterday, accidentally crossing the spider web.",3
i'm going on a blind date this weekend. i've never even been on a date.,i'm dating people this weekend. i've never been on a date.,0
"i don't know what that thing is, but it has way too many legs for my comfort.","i don't know what that thing is, but it has too many legs to comfort me with.",2
"when i was younger i was scared of almost any new experience...but since i've been mugged, kicked out of the house, lived homeless, been beaten up, won some street fights and become fully self-employed there's really nothing that scares me anymore","when i was young, i was afraid of any new experience... but ever since i was robbed, driven out of my home, homeless, homeless, beaten, won some street fights, became completely self-employed.",2
i was scared walking home alone last night,last night i was afraid to go home alone.,3
"every other night at around the same time, i keep hearing a girl scream.","every night, around the same time, i heard a girl screaming.",3
i got mugged on vacation last year.,i got robbed on my vacation last year.,3
i have to go to a early team meeting in the morning. i am unsure whats going to happen,i have to go to an early group meeting. i'm not sure what's going to happen.,1
"so, for the last two months, i had been emailing a shaker museum about visiting their location.  i had worked out all the activities for the day.  i found out just today, i had been emailing the wrong location.  so when my family and i arrived at the real location, i realized the mistake i had made.  we were so nervous and upset, we really didn't know what to expect.  thankfully, it turned out wonderfully!","so, over the past two months, i've been e-mailing a rock museum to see where they are. i designed all of today's events. i only found out today that i was in the wrong place. so when i got to the real place with my family, i realized that i made mistakes. we were very nervous and worried, and we really didn't know what to expect. fortunately, the results were great!",1
i just saw a bobcat outside my house.,i just saw a panda outside my house.,2
i was so afraid going on my first rollercoaster when i was a kid. thought the drop was going to shatter my bones.,"when i was a kid, i was afraid to go to my first wheeler and think that drops would break my bones.",3
"anytime i see a bear, i run the other way.","whenever i see a bear, i run to the other side.",2
my crush keeps hanging out with a new guy classmate a lot lately.,i've been with my new classmates lately.,2
i was so scared to sleep at night when i was a kid. i thought there were monsters under the bed.,"when i was a kid, i was afraid to sleep at night, and i thought there were monsters under the bed.",2
i was cleaning the yard and uncovered a huge nest of black widow spiders!,i was cleaning up the yard and i found a big black widowed spider's lair!,2
i am going in for acupuncture for the first time and am a bit unnerved by the idea,"the first time i went for a shot, i got a little upset with the idea.",1
waiting for my new car to be delivered,waiting for my new car.,0
i went skydiving today. i was so afraid to jump out of the plane.,i went to jump today. i was afraid to jump off the plane.,3
"i've got to get an mri and i've been waiting for the appointment for almost 3 weeks now.  i guess it's good it's not an emergency, but it's sure nerve wracking not getting it over with.","i don't think it's an emergency, but the nervous breakdown won't end.",0
"i'm scared that my neighbourhood is unsafe, there have been a lot of breakins",i'm afraid my neighbors aren't safe. there's been a lot of escapes.,3
i was so scared to go to sleep at night. i thought monsters lived under my bed.,i thought the monster lived under my bed.,2
"i am going sky diving this sunday, but i am a little scared about it.","i'm going on a dive on sunday, but i'm a little scared.",1
i think my boyfriend is cheating on me,i think my boyfriend's lying to me.,2
i didn't pay my taxes this year. i am nervous i may get audited.,i didn't pay my taxes this year. i'm nervous and i'm gonna be cleared.,0
i went rock climbing yesterday. i was so afraid peering down from the top of the mountain.,"i climbed up the mountain yesterday, and i was afraid to look down from the top.",3
"i've had a few panic attacks lately.  i'm supposed to go see the dr tomorrow about them, i hope they can give me something to help.",i've been having a panic attack. i'm going to see a doctor tomorrow. i hope they can give me some help.,0
i was so scared to go to sleep at night when i was a kid. always thought monsters were under my bed.,"when i was a kid, i was afraid to sleep at night, always thinking of monsters under my bed.",2
i was so afraid of sleeping when i was a kid. i always thought there were monsters underneath.,"when i was a kid, i was afraid to sleep. i always thought there were monsters down there.",3
"i'm scared my dog will run away, he can't see very well",i was afraid my dog would run away. he couldn't see.,3
i really think we should be this deep in the woods.,i really think we should be deep in the forest.,2
i was shocked when a huge bat hit my window last night!,"last night, a big bat hit my window. i was surprised!",3
i think i will lose my teeth and its shaking,i think i'm gonna lose my teeth and it's shaking.,2
i have to go to the doctor tomorrow. what if they find something wrong with me?,i have to see a doctor tomorrow. what if they find out what's wrong with me,3
i met a guy on a dating app. i'm not sure if i should meet him in person or not.,i don't know if i should see him myself.,1
there's 2 escaped convicts loose in my town! they were last seen in my neighborhood!,there's two escaped fugitives in my town!,2
i can't wait until friday to know if i got the promotion... the wait is killing me,i can't wait till friday to find out if i've been promoted... waiting to kill me.,0
i have a test this week and im scared,i got an exam this week. i'm scared.,0
i have to get a root canal tomorrow. i think it's gonna hurt.,i have to get a hose tomorrow. i think it hurts.,1
i really hate going in front of crowds. especially when i had to recite a poem in front of a whole crowd of people.,"i really hate to walk in front of people, especially when i recite a poem in front of people.",0
"so, my youngest sister, whom i never met face to face,  hit me up asking for me to reach out to her, but it's difficult to really know what to say. ","so, my sister, i've never seen face-to-face, hit me, asked me to contact her, but it's hard to really know what to say.",1
i went to see that new shark movie. i was so scared! i covered my eyes the whole time!,i went to see that new shark movie. i was scared. i was blindfolded!,3
"due to recent debt that i have accumulated through credit cards, my credit score has seen a significant decline. i am very concerned it might impact my credit trustworthiness","as a result of the debt i've recently accumulated through credit cards, my credit scores have fallen dramatically, and i am very concerned that this could affect my credit credibility.",2
i was on the way home last night when a large truck passed under a red light and nearly slammed into me going really fast.,"last night, on my way home, a big truck passed under a red light and almost hit me.",3
"i really do not like being around rats, they scare me.","i really don't like being around rats, they scare me.",3
i'm really afraid of snakes these days. i see a few around.,i've been really scared of snakes lately.,3
"i just watched friday the 13th for the first time. oh my god, i am hiding under the covers in my bed. i don't think i can leave.","the first time i saw friday the 13th. oh, my god, i hid under the bed cover. i don't think i can go.",3
i really get nervous when i have to drive.,i was really nervous when i was driving.,2
waiting for my twins to be born,waiting for my twins to be born.,0
a storm came through earlier and lightning struck very close by and the power went out! i was worried as sometimes the power can go out for days but luckily it came back on an hour later this time.,"the storm came earlier, the lightning strike was very close, the power went out!",3
"i am so ready for the weekend, i get to drive a nascar.",i've got enough for the weekend. i'm gonna drive nascar.,0
"i heard this strange crash noise in the garage. i thought it might have been an intruder, but it was a raccoon! ","i heard a strange crash in the garage. i thought it might be an intruder, but it's a raccoon!",2
i got invited to this one party in a shady part of town. i was hesitant to go but i did and i was glad that i did!,"i was invited to a party in the dark part of the city, and i hesitated to go, but i did, and i'm glad i did!",1
i recently was worried about a job interview even though i think it went well. i hope i get it.,"i've been worried about the job interview, and i think it's going well, but i hope i understand.",1
i have a date tomorrow night with a someone new i just met. i think i really like her so i am feeling some butterflies right now.,i have a date tomorrow night with a new guy i just met.,0
i found a gigantic spider in my shower!,i found a giant spider in the bathroom!,3
"i finally won on a scratch ticket that i bought at a gas station. it's not much, but it made me happy!","i finally got a fucking ticket at the gas station. not much, but it made me happy!",3
"i really do not like water, i can't swim.","i really don't like water, i can't swim.",2
i'm supposed to cook dinner tonight but have no idea what to cook.,"i should make dinner tonight, but i don't know what to do.",0
a bird crashed into my window today.,a bird hit my window today.,3
"i'm going to watch a film this weekend, but i am not sure if i will like it.","i'm going to the movies this weekend, but i'm not sure i like it.",1
i was expecting some doctor's results this week. i am really nervous about it.,i'm waiting for some doctor's results this week. i'm really nervous.,2
i'm going skydiving in a few days. i've never been before so i'm quite nervous about it,"i'm going to jump in a couple of days, and i've never jumped before, so i'm nervous.",2
i moved into a new apartment yesterday. and while i was alseep last night i thought someone was breaking in..heard a lot of noise on my window,"yesterday i moved into a new apartment, and i thought someone broke in early last night.",3
"i drunk texted my boss last night and told him everything that is wrong with his management style, i'm afraid to go to work because i'll get fired.","i was drunk last night and texted my boss that he had problems with his management style, and i couldn't go to work because i'd be fired.",0
"my son ran over my neighbor's cat on accident the other day. he's only 16, learning to drive still. i think my neighbor is going to try to get physically abusive with him. not sure what to do","he's 16 years old, he learns not to drive, and i think my neighbor's gonna try to physically abuse him, and i don't know what to do.",3
my partner is being a big fat jerk. i really don't think i can deal with his childish crap anymore and lies.,"my partner's a big fat guy, and i really don't think i can take it anymore.",0
i was flying back from boston a couple weeks ago and there was some insane turbulence!  i had never been so scared in my life!,i flew back from boston a few weeks ago and there was some crazy turmoil!,3
"my girlfriend wants me to go to thanksgiving at her parents this year, but i haven't even met them yet.","my girlfriend wants me to go thank her parents this year, but i haven't seen them.",1
my dog has to go stay at the doggie daycare for a couple of days so i can go to a wedding. im scared that she will think i am leaving her there and never coming back and i dont want her to feel that way. ,"i was afraid she thought i'd leave her, never come back, and i didn't want her to feel that way.",2
"i missed my purse in bus. i'm not  sure how i will go home, its late at home",i missed my wallet on the bus. i don't know how i got home. it's late.,2
i walked into class yesterday fully unprepared for our final exam. i knew for sure i would fail and not pass the class,i walked into the classroom yesterday without getting ready for the finals.,3
i heard a loud bang outside my house last night and thought someone was trying to break in.,i heard a big bang outside my house last night and thought someone was trying to break in.,3
"my neighbor killed his wife, a year ago. i would sleep during that period of time. i was shocked and afraid.","my neighbor killed his wife a year ago, and i'm going to sleep that time, and i'm shocked and scared.",3
in a way i'm scared to show love or get close in a relationship.  i mistook pity and infatuation for love and ended up being miserable.  am i gonna let that happen again? hell no,my compassion for love and my obsession with error have ended up in a tragic situation.,2
"i'm going on a work trip this weekend, but i hate flying. i'm really nervous about the flight.","i'm on a business trip this weekend, but i hate flying. i'm nervous about flying.",0
i was invited to a party last week to a pretty shady area. i didnt know if i should go or not,i don't know if i should go.,1
"it's really stormy right now. i keep glancing outside my window, hoping it doesn't get worse. i sure wouldn't like to see a tornado.","i always shined out the window, hoping things wouldn't get any worse.",2
"we're refinancing student loans, buying a house, and my wife is getting a new job.","we're refinancing student loans, buying houses, and my wife is looking for new jobs.",0
"i have to get surgery tomorrow morning. i am getting my wisdom teeth taken out, and i am pretty nervous about it.","i'm having surgery tomorrow morning, and i'm pulling my smart teeth out, and i'm very nervous.",0
we went to see the meg yesterday.  now i'm terrified of the ocean again.  way to go lol!,"we went to the cereal yesterday, and now i'm afraid of the sea.",2
i watched thus movie called sinister and it really freaked me out.,i see a movie like this and it's called evil and it really scares me off.,3
when i was younger i used to be scared to go into the basement.  after i saw the home alone movies,"when i was young, i used to be afraid to go into the basement.",2
"i have a lot of nerves today! i am sick a lot in my health and i can't seem to figure out what sets off my fibro a lot, it gives me anxiety and depression and i am just so overwhelmed with it i don't know what to do anymore!","i have a lot of nerves today. i'm very sick, and i don't seem to understand what made my fibrosis too much, which makes me anxious and depressed, and i'm so busy, i don't know what to do!",0
i was scared walking home the other night,i was afraid to walk home that night.,3
"i was walking home one night and i saw some guy standing next to a wall, luckily he didn't have any bad intentions. i was freaked out","fortunately, he didn't mean anything.",2
i just applied for a job. i'm really nervious about them not hiring me.,i'm just applying for a job. i'm very nervous they didn't hire me.,1
last week i was at the park with my kid and got distracted by my phone.  i looked up and my daughter was gone!  my stomach dropped and became really scared.  luckily i found her in the tube slide.,"last week i was in the park with the kids, distracted by the phone, and i looked up, and my daughter was gone!",3
"my friend wants me to go hiking with him this weekend on some sort of scary trail where there's thin walking trails along some dangerous ledges... not really my thing, but he's been kind of lonely recently","my friend wants me to go hiking with him over the weekend, on a horrible little road, along some dangerous little trails deep down... it's not my business, but he's been a little lonely lately.",1
just got a new position after the old manager was fired,the old manager just changed his position after he got fired.,1
i started bleeding when i poo.,i started bleeding when i had to.,2
as a teenager my family moved around a lot. i never looked forward to entering a new school.,"my family moved around a lot, and i never expected to get into a new school.",1
i was driving and this guy started following no matter which turn i took.  i was worried that he was going to follow me home,"i was driving, and this guy started following me, no matter where i turned, and i was afraid he'd come home with me.",2
i heard a strange noise coming from the kitchen late at night,"i heard a strange noise from the kitchen, late night from the kitchen.",3
i saw a strange figure in the woods,i saw a strange person in the woods.,3
i did not want to go on the rollercoaster,i don't want to get on the roller coaster.,2
when i went in to a haunted house and a guy chased us. it was halloween.,"when i entered the haunted house, there was a guy after us. it was halloween.",3
"i'm scared of the dark, but i have to walk home from work in the dark. it is really nerve wraking. ","i'm afraid of the dark, but i have to walk home from work in the dark.",2
before my final exam on of the semester. i needed a 90% to pass.,i'm gonna need 90% of my final exam before the end of the semester.,2
when i got in to a car accident and injured my arm. the car was on fire.,"when i was in a car accident and my arm was injured, the car was on fire.",2
i'm going to ride a jet ski for the first time this weekend.,i'm gonna be skiing on a motorcycle for the first time this weekend.,0
i went on my first roller coaster last month!  i was scared out of my mind and was sweating bullets!,it's the first time i've been on a roller coaster last month!,3
i was on vacation and i saw a ghost at a hotel.  i couldnt fall asleep the whole night.  it was so scary,i saw ghosts at the hotel on vacation. i couldn't sleep all night.,2
i have a doctor's appointment and i'm so scared,i have an appointment with a doctor. i'm scared.,2
i was scared walking home the other day,i was scared to go home that day.,2
i had a really good job interview. it is so nerve racking waiting for the call to see if i got it or not. ,it's so nervous waiting to call me to see if i got it.,0
i was scared the other night when i had to walk home alone,i was scared that night when i had to walk home alone.,2
i just dropped my son off at daycare for the first time.  it was the first time i've been away from him for more than a couple hours.,this is the first time i've left him for more than a few hours.,0
when i used to be prescribed on adderall and the dosage was too high i would get jumpy and paranoid.,i've been prescribed in gaderore and the dose is too high for me to get nervous and paranoid.,1
"last week, me and my husband had an argument. he slapped me. since then, i am very scared of him.","last week, my husband and i had a fight and he slapped me.",3
i was scared to walk home last night,last night i was afraid to walk home.,2
man this weekend might be weird,men can be weird this weekend.,2
i saw a hurricane coming towards my house,i saw a hurricane coming to my house.,3
"my husband had to go out of town for work so i've been home alone.  i do not like it, i feel like someone is going to break in or something, even though i'm perfectly safe.  i cannot sleep at all.","my husband had to go out to work, so i was home alone, and i didn't like it, and i felt like someone was coming in, even though i was safe, and i couldn't sleep at all.",3
i'm really scared of going down to my basement. it's so dark down there. ,i'm really scared to go down to my basement. it's too dark.,2
"i am scared of horror movies, i never could tolerate them",i'm afraid of horror movies. i can't stand it.,2
i have a big job interview coming up. i am so nervous i almost dont want to go.,"i have a big job interview coming up, and i'm nervous, and i almost don't want to go.",2
someone got shot near my house the other day.  i am terrified now and want to move.,"one day someone was shot near my house, and i was scared and i wanted to move.",2
i really nervous right now. i am waiting on a phone call to see if i got a job i interviewed for.,i'm nervous right now. i'm waiting for a call to see if i've got a job.,0
