text,aug_text,label
"one time in school, i was asked to give a speech in front of the class. i really don't like speeches and was nervous leading up to the speech.","once in school, i was asked to give a speech before class, and i really didn't like a speech, and stress led to a speech.",0
i am getting an evaluation at work soon. it might not go well.,i'm about to get a job evaluation.,3
i was scared when i went home alone the other day,"when i came home alone that day, i was scared.",3
i am a bit afraid to call ac on my neighbor as i don't want him to retaliate. but i have too for the dogs sake.,"i'm a little scared to call my neighbor, ac, because i don't want him to take revenge, but i'm thinking about the dog.",2
"when our home was broken into, it was so scary.","when our home was broken into, it was so horrible.",3
"i love to travel, but i hate flying. last time i took a flight, i was nervous and didn't want to go.","last time i was on a plane, i was nervous. i didn't want to go.",0
i was in one of those rent to buy furniture stores the other day and of course i got hounded by a salesman. he was pitching me some unrealistic sounding deal on a kitchen table that i totally didn't believe. it was so hard to get him to leave me alone. ,"of course, i was entangled by a salesman who asked me to do some unrealistic pronunciation on the kitchen table.",1
my friends want me to scuba diving with them. i really don't want to because i worry about sharks and other creatures. ,"my friends want me to dive with them, and i really don't want to because i'm worried about sharks and other creatures.",2
i was nervous when i had to go to jury duty. i just did not want to go,i was nervous when i had to go to the juror. i just didn't want to go.,0
i had real fear when a tornado was close to my home. i thought we might die,"when the tornado was close to my house, i was afraid.",2
i was nervous when it was raining real bad last night. i hate storms,i was nervous last night when it rained. i hate storms.,2
"i had to get my foot checked out at the doctor recently, always makes me nervous.",i've got to check my feet with the doctor lately. it's always making me nervous.,0
i am going to my first haunted house this october!  i don't know why i feel so scarred!,i'm going to my first ghost house this octopus!,2
alone while family was at a party when someone rammed a quad into the garage.,"when a man's family was at a party, someone ran into the garage.",2
"a stray dog chased me when i was a kid, from then on i have never liked dogs","when i was a kid, a stray dog chased me, and ever since then, i never liked dogs.",3
i almost hit a deer driving down the highway a few days ago.,"i almost hit a deer a few days ago, hit the freeway.",3
the other day i got a strange message from a distant relative. it said they needed surgery but couldn't afford to pay for a doctor. i was so worried.,i received a strange message from a distant relative the other day that they needed surgery.,0
my husband wants to go parasailing together when we go to mexico next month.,"when we went to mexico next month, my husband wanted to go for a walk.",2
a giant wasp tried to attack me on my balcony. another reason why i don't like to go on my balcony!,"a giant wasp tried to attack me on my balcony, another reason why i didn't like it on my balcony!",2
my ex is coming over to talk. i'm scared that he wants to make up. i don't,my ex-boyfriend wants to come over and talk. i'm afraid he wants to make up.,2
there was a racoon by the dumpster last night when i was taking out the trash.,"last night, when i took out the trash, there was a raccoon next to the dumpster.",3
a truck almost ran me off the road the other day.,"the other day, a truck almost knocked me off the road.",3
i heard a hissing noise outside my door and i swear to god it was a snake. it turned out to my brother playing a prank on me.,"i heard a sound outside the door, and i swear to god it was a snake.",3
i am ready for the next mcgregor fight.,i'm ready for the next mcgregor fight.,0
i am very reluctant to confront my boss on her behaviors recently. she is picking on all the male employees for no reason..,she criticizes all male employees for no reason.,1
last night i heard strange noises coming from my basement. i creeped down the stairs with a flashlight. i nearly jumped out of my skin when i saw a humongous rat in the corner!,"last night i heard a noise in the basement, and i climbed down the stairs with a flashlight, and i almost jumped out of my skin.",3
when my house burned down in the 8th grade,my house burned down in the eighth grade.,2
when i went to a haunted house and got spooked.,"when i went to the haunted house, i got scared.",3
i am moving to a new neighborhood next week. what if the neighbors dont like me.,what if the neighbors don't like me,3
"i was walking home by myself when i was studying abroad in another country, and a man was following me and kind of harassing me verbally.","when i was studying in another country, i walked home alone, a man followed me, and molested my words.",3
i can't wait for the last seans of game of thrones,i can't wait for the last throne.,0
i've been reluctant to confront my mother on her stealing my money. i know what she's doing is wrong but she is mother after all.,"i know what she's doing is wrong, but she's a mother after all.",1
i'm meeting my boyfriends parents soon. i am so scared.,i'll see my boyfriend's parents soon. i'm scared.,3
had hellp syndrome with 1st child.  almost died,he had hell syndrome with his first child. he almost died.,3
i am so nervous.  i have a blind date tomorrow night.,i'm so nervous. i have a blind date tomorrow night.,0
i am meeting my girlfriends parents tomorrow. i am so nervous,i'm meeting my girlfriend's parents tomorrow. i'm so nervous.,3
im a little nervous.  i just finished my online class and the grades still aren't up yet.,"i just finished an online class, and i haven't gotten any results yet.",1
i am so scared to go off to college this year.,i'm scared to go to college this year.,3
a group of students at the university are extorting money from me. i am too afraid to go back to the university.,a group of students at the university are blackmailing me for money.,2
i am going to try my grandmas recipe for dressing today. i am scaerd i won't do it justice.,today i'm going to try my grandmother's formula and change it to today's dress.,2
going on roller coasters makes me so nervous. i can't stand the feeling in my chest on the comedown.,i can't stand the feeling in my chest.,0
i think i'm going to get evicted.,i think i'm getting kicked out.,2
my car started to make loud noises coming out of engine. it happens while accelerating,"my car starts to sound, the engine starts to sound, and it happens when it accelerates.",2
i am reluctant to confront my my best friend's girlfriend. i think my best friend is cheating on her...,i don't want to face my best friend's girlfriend.,1
i have a secret.  i hate being in the dark.  it terrifies me,i have a secret. i hate it in the dark. it scares me.,2
i can't wait for date nigiht this week. i bought my hubb an apple watch.,i can't wait for this week's date. i bought an apple watch.,0
i heard a banging on my window at 3am last night. i was terrified on what it was but it turned out to be a tree branch.,"last night at 3:00 a.m., i heard a window ring, and i was afraid of what it was, but it turned out to be a branch.",2
i was so nervous taking my dog to the vet today.  i was scared something might be wrong.,i was nervous when i took the dog to the vet today.,0
welp.. i am a little nervous about going back to school this year.  i am starting at a new school.  an alternative school.,"i'm a little nervous about going back to school this year, starting with the new school.",1
i am very anxious this weekend as someone i was trying to fix a relationship with is acting up again. i just get a lot of anxiety about what they will pull next because they usually do pull something.,"i'm very anxious this weekend, because someone i'm trying to fix the relationship is moving again, and i'm just very anxious what they're going to pull next because they usually do pull stuff.",0
"i'm thinking about switching jobs, but i'm not sure if i should.","i'm thinking about changing jobs, but i'm not sure if i should.",1
well someone i am thinking of working things out with talked about coming over on sunday. i felt really uncomfortable with that because they haven't done enough to build back enough trust with me yet. and lo and behold..they acted up and made the decision for me anyway.,and it's uncomfortable because they haven't done enough to build enough trust with me.,1
i was pretty shaken up from the scary movie id,i was scared from the horrible movie id.,3
" the other week it sounded like a bomb went off. i am in a very dangerous city, so you never know here.","last week, it sounded like a bomb exploded. i was in a very dangerous city, so you never knew.",3
i was very apprehensive about someone coming to my house this weekend. i felt very uncomfortable and like i would be stepping back in too old patterns,i'm worried about someone coming to my house this weekend.,1
"i am sometime to afraid to speak in public, for example, during meeting at work.","i am sometimes afraid to speak in public, for example, during working meetings.",2
i am ready for my wedding.,i'm ready for my wedding.,0
"i have pain in my stomach for about a week now. by reading what is on the internet, i am very worried.","read the content on the internet, i'm worried.",2
i sent in my short fiction for a competition too close to the deadline. i'm not sure if it'll make it on time.,"i'm sending my novel to a competition that's too close to the deadline, and i'm not sure if it's on time.",1
i am going on a roller coaster for the first time tomorrow.   i and so nervous!,"for the first time tomorrow, i'm in a roller coaster. i'm so nervous!",0
i am really worried that i will miss my flight tomorrow.,i'm really worried about the flight tomorrow.,2
"an old ""friend"" that's a girl wants to go get drinks tonight.  not sure if its a trap or not.","an old ""friend"" who wants to go for a drink tonight. i don't know if it's a trap.",0
i few years back i was in a really bad car accident.  i flipped my truck multiple times in a ditch.  it was an extremely scary experience!,i had a really bad accident a few years ago.,3
i am worried i will drown when i go swimming.,i was afraid i'd drown while i was swimming.,3
i am home alone this weekend. i do not like that. it gets too quiet.,i'm home alone this weekend. i don't like this. it's too quiet.,2
i'm taking the drivers test for my license monday. i am so nervous.,my driver's license on monday. i'm so nervous.,2
i can't wait until i have grandkids. ,i can't wait for my grandkids.,0
i'm not sure if my boyfriend is the right one for me.,i'm not sure if my boyfriend suits me.,1
"when i was little, i was always afraid of going to bed. always thought there was a monster in my closet.","when i was a kid, i was always afraid to go to bed and think i had a monster in my closet.",3
i was robbed at gunpoint once when i worked as a cashier. ,i was robbed with a gun when i was a cashier.,3
my son goes to kindergarten in a week and i can't imagine him being gone through the day. it's hard to not be worried about how he'll be at school.,"my son goes to kindergarten in a week, and i can't imagine how he's doing today, and it's hard not to worry about what he's going to do at school.",1
i was scared when i had t go home alone the other day,"when i came home alone that day, i was scared.",2
i was afraid when i went home alone the other day,"when i came home alone that day, i was scared.",2
i am a little nervous about dating,i'm a little nervous about dating.,1
i was scared going home alone!,i'm afraid to go home alone!,3
"i lost my medicine today, one that helps me focus my attention span. i needed it especially because i had a job interview that i wanted to be sharp for. i felt weird during the interview, and now i don't know how i did...","i lost my medication today, a drug that helped me focus, and i needed it especially, especially because i had a job interview, and i had a job interview.",0
 i start a new job as a nurse next monday and i'm so nervous. nothing can prepare you for the real world of nursing compared to nursing school.,"i'm starting my new job as a nurse next week, and i'm nervous.",0
i am feeling uneasy about going to court,i'm worried about going to court.,0
when i was a kid i was alone at night during a huge thunderstorm.,"when i was a kid, i was alone at night in a huge thunderstorm.",2
i am worried about my interview,i'm worried about my interview.,0
i was in a car wreck on the way home from church. ,i was in a car accident on my way home from church.,2
i've have been watching this new show sharp objects. i don't think its supposed to be scary but i'm scared,"i've been watching this new, sharp thing, and i don't think it's supposed to be scary, but i'm scared.",3
i am worried about not being ready for the party on friday,i'm afraid i'm not ready for the party on friday.,0
i was pretty terrified when a tornado watch was issued. i was real worried,"when the tornado was released, i was scared, and i was worried.",2
"i have a hard time eating, i am allergic to so much! it gives me a lot of mixed feelings whenever i think about eating as i don't know what will happen with my digestions","whenever i want to eat, it makes me feel complicated because i don't know what my digestor is gonna do.",0
when i got home tonight my outdoor window was broken- to my cat room. i do not know who broke it or how. i am in a bad neighborhood so it was very frightening. ,"when i got home tonight, my outdoor window was broken into my cat room, and i don't know who broke it or how.",2
clown movies scare me.,the clown movie scares me.,3
i came home and my outside window to my cat room was broken. it makes me feel scared as i am in a bad neighborhood and would like to know what happened when i wasn't home?,"it scares me because i'm in a bad neighborhood, want to know what happened when i wasn't home",0
i was very scared when a tornado touched down close to my home. i thought i was going to die,"when the tornado approached my house, i was scared. i thought i was dying.",3
"someone broke a window in my side yard today. i don't know when, i assume i was gone as my dogs wouldv'e went nuts. i live in a bad neighborhood and it's late so i am still up a bit scared about it.","i don't know when, i guess, i'm going because my dog is going crazy, and i live in a bad neighborhood, and it's late, so i'm still a little scared.",3
i was nervous when i started a new school. i did not know anyone,i was nervous when i started my new school. i don't know anybody.,1
my sister has been begging me to go to a new haunted museum with her. i am not really into that kind of stuff. it really freaks me out and will give me bad dreams.,"my sister's been begging me to go to the new haunted museum with her, and i don't really like that kind of thing, and it really scares me, and it makes me have nightmares.",2
"i got in a bit of an altercation with a co-worker today, and i'm afraid it may lead to me losing my job. it started with a misunderstanding,and when they didn't want to simply accept that it was a misunderstanding after i apologized, i decided to simply defend myself and there was a verbal back-and-forth witnessed by a few people. this is not the image i wanted to have at my job... ","i had a little argument with one of my colleagues today, and i was afraid that this might lead to my losing my job, and at first it was a misunderstanding, and when they didn't want to simply admit that it was a misunderstanding after i apologized, i decided to just defend myself.",3
"i don't like to go shopping at big stores. whenever i think of going to a big store like walmart oe meijers, i start feeling panicked.","i don't want to go shopping at a big store, and whenever i think about a big store like wal-mart, i panic.",0
"my significant other woke up last night with... a roach inside of her ear! she was complaining about pain in her ear, and a head ache that was incredibly severe. so, we took her to the doctor and he saw it with a light... and put water in her ear to get it out. disgusting! ","she complained about an earache and a very serious headache, so we took her to the doctor, and he saw it with the light... and poured water out of her ear.",3
 i almost got hit by a semi truck today on the highway. it scared me half to death.,"i almost got hit by half a truck on the freeway today, scared me half to death.",3
 my son has been having stomach pain for months now and the doctors can't figure out what it is. they basically say he has to get worse for them to find a diagnosis if some new problem comes up. i'm so scared.,"my son has had a stomach ache for months, and the doctors don't know what it is, and they basically say that if there's a new problem, the doctors have to be harder to diagnose, and i'm scared.",2
there is a little cat i tried to help last night. he ran when my dog charged at him though and i am scared of what has happened to him. a lot of cats get hit around here,"last night i tried to help a kitten, he ran around, and when my dog charged him, i was afraid of what happened to him.",3
"my daughter keeps begging me to watch it. i am going to tomorrow, with all of the lights on.",my daughter's been begging me to see it. i'll be there tomorrow. lights on.,2
"my father and brother are in a serious conflict with each other right now, as my father has complained about the way my brother raises his son. obviously it's a really stressful, tenuous situation and i have no idea who's side to take, and i'm worried it will lead to them not wanting to keep in touch anymore.","my father and my brother are in serious conflict now, and my father complains about the way my brother raised his son, and it's obviously a very tense and fragile situation, and i don't know whose side is acceptable, and i'm afraid it will lead them to no longer want to be in touch.",2
i have a big job interview tomorrow and it has got me nervous.,"i have a big job interview tomorrow, which makes me nervous.",0
my husband wants to have another child. i am just not sure that it is the best idea right now. i just cannot decide.,my husband wants to have another child. i'm just not sure it's the best idea at the moment.,1
"last week, i think i saw a ghost outside.  i was so scared!","last week, i thought i saw a ghost outside. i was scared!",3
i am very scared for the usa.,i'm very afraid of us.,3
my husband wants us to move to another state for better job opportunity. i just do not know of it is worth starting over and having no family around.,"my husband wants us to move to another state in search of better jobs, and i just don't know if it's worth starting over.",1
i saw a scary movie last night.  i was so frightened by it!,i saw a horror movie last night. it scared me!,2
i am very scary of the things trump can do as a president.,i'm very afraid of what the king can do as president.,3
i am very scary and anxious.,i'm scared and anxious.,3
i am very anxious on the direction the country,i'm worried about the direction of the country.,1
i am very nervous to be a father.,i'm nervous about being a father.,0
i am not looking forward to jury duty.,i don't expect the jury's duty.,1
i am worried my cancer may return.,i'm afraid my cancer will come back.,2
there was a centipede in my bedroom earlier. i was absolutely scared.,i had a urinal in my bedroom. i was scared.,3
"i'm thinking about upgrading my computer soon, but i'm not sure if it's worth the cost.","i want to upgrade my computer as soon as possible, but i'm not sure it's worth it.",1
i got pulled over by the police today.  i was really scared when it happened.,"i was stopped by the police today, and i was scared when it happened.",3
a dragonfly was chasing me earlier this afternoon.  i was so afraid of getting hurt.,i was only chasing after me earlier this afternoon. i was afraid to get hurt.,3
"i once went to a haunted house, and it was so scary! people were jumping out of corners while walking through it.","i've been to a haunted house, and it's so horrible!",3
i am scared these days.,i'm scared these days.,2
"this past month, i was involved in a car crash me being the main driver","last month, i got involved in a car accident. i'm the main driver.",3
we were under a significant storm warning. the sky turned dark and the wind began to blow harder.,the sky is getting darker and the wind is starting to blow even harder.,2
"once i felt totally out of place in a social setting, it was very hard for me.","i used to feel completely out of place in the social setting, which was hard for me.",0
being alone in a foreign country.,alone in a foreign country.,2
we had to rush my grandmother to the er yesterday because she passed out and hit her head on the tile floor. it was very scary and she had no memory of it,"yesterday, my grandmother fainted on the floor floor and hit her head, so we had to rush my grandmother into the room because she passed out and her head hit the floor, which was very scary, and she had no memory of it.",3
"i have a big presentation tomorrow, and i'm not sure if i'm prepared enough. i think i need more time to refine my notes","i have a big speech tomorrow, and i don't know if i'm ready enough, and i think i need more time to improve my notes.",0
when i was a child i nearly drowned in a swimming pool. i was so scared.,"when i was a kid, i almost drowned in the pool. i was scared.",3
i am hoping to win the lottery this week,i wish i could win the lottery this week.,1
my a/c is going out and it is supposed to be real hot today.  i hope it doesn't break on me.,my a/c's going out. it's supposed to be hot today. i hope you don't get mad at me.,0
my wife and i have been quite scared lately.  there has been a rash of burglaries and robberies in our neighborhood lately and some have involved violence against the home owners!,"my wife and i have been so scared lately that there have been burglaries and robberies around us, some involving violence against homeowners!",2
my credit score has fallen by some 50 points in the last month. my debts are accumulating.,my credit score dropped by about 50 points last month.,0
last night i was in bed and a spider came straight down from the ceiling fan onto the comfortor.,"last night, i was lying on my bed, and a spider came down straight from the ceiling fan and climbed to the comforter.",3
i am really scared.  i moved into this new house and i swear to you it is haunted,i'm really scared. i moved into this new house. i swear it's haunted.,3
i was awoke to a dar figure in my room,i woke up with a picture of the dar in the room.,3
"i want to move to new york , buy its all new to me there","i want to move to new york, buy it all new to me there.",2
"i've had a lot of headaches recently, so i need to see the doctor.  but i'm really nervous about what he might find, so i've been putting it off.","i've had a lot of headaches lately, so i need to see a doctor, but i'm nervous about what he might find, so i've been stalling.",1
driving sometimes gets me very nervous. i don't like the thought of getting in a deadly car accident.,"you know, driving makes me nervous sometimes. i don't like fatal car accidents.",0
"my ex girlfriend started talking to me out the blue again , im not sure to trust her again","my ex-girlfriend is talking to me again, and i can't believe her anymore.",1
the final exam for my linear algebra summer class is in a week and i do not feel prepared for it,i didn't feel ready to finish the finals of my linear algebra summer school in a week.,0
i hate wasps so much. they always seem to get into my apartment somehow and i turned into a little girl!,"i hate the wasps, they always seem to have entered my apartment somehow, and i became a little girl!",2
i hate bugs and insects so much. i've called pest control but i still have them everywhere in my house. i'm so scared of them crawling around all the time...,"i hate bugs. i called the pest control, but i have them all over the house.",2
"once, i was walking home from work and it was late. my street was unusally quiet and there was a man walking quickly behind me. i was very scared. he ended up passing me but he whispered a nasty word as he walked past. ","one time, i went home from work, and it was late. my street was quiet, and there was a man walking very fast behind me. i was scared. he finally passed me, but he whispered.",2
"i was on a boat with some friends and we were stranded out at sea, didn't know if we'll ever see land again.","i'm on a boat with some friends, and we're stuck at sea, and we don't know if we'll ever see land again.",3
i start a new job on monday!  i am excited but very nervous!,"i started my new job this week. i'm excited, but i'm nervous.",0
i hate presenting a project in front of my class. it's so nerve-racking. ,"i hate to show a project before my class, it's so nervous.",0
i am scared of trump right now.,i'm afraid of the throne now.,2
"i felt anxious when i went to my interview the other day. even though i was more than prepared, i was still overly nervous.","i was anxious when i went to the interview that day, even though i had enough to prepare, i was too nervous.",0
i live in florida and experience hurricanes. two recent hurricanes have threatened my home and potentially my life.,the last two hurricanes threatened my home and could threaten my life.,3
i am so scared for my sister's health. she is in the hospital and i hope she doesn't have cancer.,"she's in the hospital now, and i hope she doesn't have cancer.",3
